Address,Permit No,Lat,Long,Description,Link,Issued
11 Pitt Street CARLTON VIC 3053,-37.796028,144.972621,TP-2014-311,Buildings and works (replacement of windows in front facade),http://www.melbourne.vic.gov.au/BuildingandPlanning/Planning/Pages/Planningregisteronlinesearchresults.aspx?appid=212578,Yes
Victorian College Of The Arts 204-234 St Kilda Road SOUTHBANK VIC 3006,-37.8252842,144.9681527,TP-2014-312,Application for Liquor Licence,http://www.melbourne.vic.gov.au/BuildingandPlanning/Planning/Pages/Planningregisteronlinesearchresults.aspx?appid=212580,Yes
162-168 Collins Street MELBOURNE VIC 3000,-37.814505,144.967846,TP-2014-313,Installation of two new entries at the east and west ends of Collins Street facade,http://www.melbourne.vic.gov.au/BuildingandPlanning/Planning/Pages/Planningregisteronlinesearchresults.aspx?appid=212581,Yes
168 Russell Street MELBOURNE VIC 3000,-37.8122752,144.9681524,TP-2014-314,Construction of business identification signage and construction of alterations to the shopfront including a canopy,http://www.melbourne.vic.gov.au/BuildingandPlanning/Planning/Pages/Planningregisteronlinesearchresults.aspx?appid=212596,Yes
64-90 Sutton Street NORTH MELBOURNE VIC 3051,-37.7919534,144.9382626,TP-2014-315,Constuction and display of business identification signage; buildings and works to provide additional shopfront entry,http://www.melbourne.vic.gov.au/BuildingandPlanning/Planning/Pages/Planningregisteronlinesearchresults.aspx?appid=212598,Yes
310 Cardigan Street CARLTON VIC 3053,-37.797626,144.966269,TP-2014-316,Replacement of existing fence,http://www.melbourne.vic.gov.au/BuildingandPlanning/Planning/Pages/Planningregisteronlinesearchresults.aspx?appid=212601,Yes
24-38 Little Bourke Street MELBOURNE VIC 3000,-37.81034,144.971412,TPS-2014-20,Installation of three skylights,http://www.melbourne.vic.gov.au/BuildingandPlanning/Planning/Pages/Planningregisteronlinesearchresults.aspx?appid=212608,No
19-21 Rourke Lane KENSINGTON VIC 3031,-37.793447,144.916895,TP-2014-318,Construction of additional floor space within the existing dwelling,http://www.melbourne.vic.gov.au/BuildingandPlanning/Planning/Pages/Planningregisteronlinesearchresults.aspx?appid=212617,Yes
106 Jolimont Road JOLIMONT VIC 3002,-37.8178727,144.979047,TP-2014-317,Use of the existing building as a dwelling with an increase to the statutory car parking rate,http://www.melbourne.vic.gov.au/BuildingandPlanning/Planning/Pages/Planningregisteronlinesearchresults.aspx?appid=215571,Yes
393-403 Bourke Street MELBOURNE VIC 3000,-37.8146701,144.9619595,TP-2014-307,appliction to remove restriction of right of way and remove an easement,http://www.melbourne.vic.gov.au/BuildingandPlanning/Planning/Pages/Planningregisteronlinesearchresults.aspx?appid=212407,Yes
18-20 Punch Lane MELBOURNE VIC 3000,-37.810431,144.971108,TP-2008-155/A,"Construction of a multi storey building with roof terrace, and waiving of the associated bicycle facilities requirement",http://www.melbourne.vic.gov.au/BuildingandPlanning/Planning/Pages/Planningregisteronlinesearchresults.aspx?appid=194758,No
65-67 Flemington Road NORTH MELBOURNE VIC 3051,-37.799353,144.953975,TP-2013-255,Restaurant and Cafe Licence plus installation of business identification signage,http://www.melbourne.vic.gov.au/BuildingandPlanning/Planning/Pages/Planningregisteronlinesearchresults.aspx?appid=194769,Yes
206 Rathdowne Street CARLTON VIC 3053,-37.794036,144.971392,TP-2013-256,Buildings and works for alterations and additions to the existing dwelling including part demolition,http://www.melbourne.vic.gov.au/BuildingandPlanning/Planning/Pages/Planningregisteronlinesearchresults.aspx?appid=194771,Yes
92 Roden Street WEST MELBOURNE VIC 3003,-37.80711,144.948146,TP-2013-245,Externally paint the facade and fence of the existing dwelling,http://www.melbourne.vic.gov.au/BuildingandPlanning/Planning/Pages/Planningregisteronlinesearchresults.aspx?appid=194676,Yes
65 Kay Street CARLTON VIC 3053,-37.795387,144.972691,TP-2013-246,"Part demolition, alterations and additions to a single dwelling on a lot less than 300 square metres",http://www.melbourne.vic.gov.au/BuildingandPlanning/Planning/Pages/Planningregisteronlinesearchresults.aspx?appid=194677,Yes
35 Smith Street KENSINGTON VIC 3031,-37.791299,144.933091,TP-2013-247,Alterations and additions to the existing dwelling,http://www.melbourne.vic.gov.au/BuildingandPlanning/Planning/Pages/Planningregisteronlinesearchresults.aspx?appid=194678,Yes
1 Rogers Street PORT MELBOURNE VIC 3207,-37.824263,144.937548,TP-2013-248,"Use and development of the land for a warehouse with showroom and office,  partial demolition of the existing building and provision of car parking in excess of the prescribed rates.",http://www.melbourne.vic.gov.au/BuildingandPlanning/Planning/Pages/Planningregisteronlinesearchresults.aspx?appid=194679,Yes
Boeing Aerostructures Australia 224-260 Lorimer Street FISHERMANS BEND VIC 3207,-37.8268261,144.9116167,TP-2013-249,Buildings and works asociated with the installation of two dust extraction units adjacent to Building 4,http://www.melbourne.vic.gov.au/BuildingandPlanning/Planning/Pages/Planningregisteronlinesearchresults.aspx?appid=194680,Yes
354-360 William Street MELBOURNE VIC 3000,-37.8106307,144.956026,TP-2013-250,Creation of Easement for footway,http://www.melbourne.vic.gov.au/BuildingandPlanning/Planning/Pages/Planningregisteronlinesearchresults.aspx?appid=194705,Yes
109-115 Hawke Street WEST MELBOURNE VIC 3003,-37.807842,144.946617,TP-2013-251,"Change of use of an existing building to food and drink premises, office and two residential apartments, external alterations to the building in a Heritage Overlay and reduction in the number of car parking spaces",http://www.melbourne.vic.gov.au/BuildingandPlanning/Planning/Pages/Planningregisteronlinesearchresults.aspx?appid=194710,No
82 River Esplanade DOCKLANDS VIC 3008,-37.7783992,144.9016347,TP-2015-142,Erection and display of business identification and sky signs,http://www.melbourne.vic.gov.au/BuildingandPlanning/Planning/Pages/Planningregisteronlinesearchresults.aspx?appid=228969,Yes
99 Hotham Street EAST MELBOURNE VIC 3002,-37.81467,144.98711,TP-2015-133,Partial demolition and construction of extensions and alterations to the existing dwelling,http://www.melbourne.vic.gov.au/BuildingandPlanning/Planning/Pages/Planningregisteronlinesearchresults.aspx?appid=228866,No
26 Erskine Street NORTH MELBOURNE VIC 3051,-37.79458,144.944419,TP-2015-134,2 Lot Subdivision PS730571H,http://www.melbourne.vic.gov.au/BuildingandPlanning/Planning/Pages/Planningregisteronlinesearchresults.aspx?appid=228913,No
497-513 Rathdowne Street CARLTON VIC 3053,-37.7995895,144.9705583,TP-2015-135,2 Lot Subdivision PS627030V - Stage 10,http://www.melbourne.vic.gov.au/BuildingandPlanning/Planning/Pages/Planningregisteronlinesearchresults.aspx?appid=228917,Yes
517-537 Flinders Lane MELBOURNE VIC 3000,-37.819884,144.956608,TP-2015-136,10 Lot Subdivision SP34396,http://www.melbourne.vic.gov.au/BuildingandPlanning/Planning/Pages/Planningregisteronlinesearchresults.aspx?appid=228919,No
Lantern 705-715 Collins Street DOCKLANDS VIC 3008,-37.8208296,144.9479048,TP-2015-126,"Use of part of the land as an open lot car park and creation of an access to a road in a Road Zone, Category 1",http://www.melbourne.vic.gov.au/BuildingandPlanning/Planning/Pages/Planningregisteronlinesearchresults.aspx?appid=228758,No
130 Faraday Street CARLTON VIC 3053,-37.798795,144.970477,TP-2015-127,Alterations and additions to existing gallery and dwelling; construction of an additional dwelling; and reduction of car parking requirements,http://www.melbourne.vic.gov.au/BuildingandPlanning/Planning/Pages/Planningregisteronlinesearchresults.aspx?appid=228767,No
Southgate Complex 16-60 City Road SOUTHBANK VIC 3006,-37.8216104,144.9661749,TP-2015-125,Use of the site for the purposes of a tavern and a reduction in the statutory requirement for bicycle facilities,http://www.melbourne.vic.gov.au/BuildingandPlanning/Planning/Pages/Planningregisteronlinesearchresults.aspx?appid=228771,Yes
68 Story Street PARKVILLE VIC 3052,-37.796483,144.954985,TP-2015-128,Buildings and works for the installation of a 100 litre water tank on the front verandah,http://www.melbourne.vic.gov.au/BuildingandPlanning/Planning/Pages/Planningregisteronlinesearchresults.aspx?appid=228776,Yes
106-108 Miller Street WEST MELBOURNE VIC 3003,-37.8054607,144.944157,TP-2015-129,3 Lot Subdivision PS733952D,http://www.melbourne.vic.gov.au/BuildingandPlanning/Planning/Pages/Planningregisteronlinesearchresults.aspx?appid=228792,Yes
8 Ormond Street KENSINGTON VIC 3031,-37.796503,144.930257,TP-2013-23,"Replace timber picket fence, wire gate, timber decking and removal of shed at rear of property.",http://www.melbourne.vic.gov.au/BuildingandPlanning/Planning/Pages/Planningregisteronlinesearchresults.aspx?appid=190807,Yes
289 La Trobe Street MELBOURNE VIC 3000,-37.810774,144.960734,TPS-2013-1,External painting of existing building facade,http://www.melbourne.vic.gov.au/BuildingandPlanning/Planning/Pages/Planningregisteronlinesearchresults.aspx?appid=190824,No
130-140 Errol Street NORTH MELBOURNE VIC 3051,-37.801583,144.9499764,TP-2013-24,Subdivision in accordance with PS701452F.,http://www.melbourne.vic.gov.au/BuildingandPlanning/Planning/Pages/Planningregisteronlinesearchresults.aspx?appid=190832,Yes
367-377 Royal Parade PARKVILLE VIC 3052,-37.784929,144.958563,TP-2013-20,Installation and display of an internally-illuminated sign,http://www.melbourne.vic.gov.au/BuildingandPlanning/Planning/Pages/Planningregisteronlinesearchresults.aspx?appid=190717,No
155-161 Boundary Road NORTH MELBOURNE VIC 3051,-37.789796,144.939566,TP-2013-21,Use of the premises as an educational training facility and a reduction in the car parking requirements,http://www.melbourne.vic.gov.au/BuildingandPlanning/Planning/Pages/Planningregisteronlinesearchresults.aspx?appid=190718,Yes
River View House 274-282 Flinders Street MELBOURNE VIC 3000,-37.817363,144.965001,TP-2013-22,Buildings and works to an existing shopfront,http://www.melbourne.vic.gov.au/BuildingandPlanning/Planning/Pages/Planningregisteronlinesearchresults.aspx?appid=190773,Yes
36 Shiel Street NORTH MELBOURNE VIC 3051,-37.796681,144.943312,TP-2007-757/D,Demolition of existing dwelling and construction of a new two-storey dwelling,http://www.melbourne.vic.gov.au/BuildingandPlanning/Planning/Pages/Planningregisteronlinesearchresults.aspx?appid=190713,Yes
176 Bellair Street KENSINGTON VIC 3031,-37.793611,144.9299276,TP-2013-19,Construction of a pergola/shade structure over part of rear courtyard,http://www.melbourne.vic.gov.au/BuildingandPlanning/Planning/Pages/Planningregisteronlinesearchresults.aspx?appid=190715,Yes
Melbourne Central 183-265 La Trobe Street MELBOURNE VIC 3000,-37.8100247,144.9633992,TP-2013-14,Partial demolition of the building,http://www.melbourne.vic.gov.au/BuildingandPlanning/Planning/Pages/Planningregisteronlinesearchresults.aspx?appid=190642,Yes
52 Lambeth Street KENSINGTON VIC 3031,-37.790983,144.933918,TP-2013-15,Extension to a single dwelling on a lot,http://www.melbourne.vic.gov.au/BuildingandPlanning/Planning/Pages/Planningregisteronlinesearchresults.aspx?appid=190652,No
339 King Street WEST MELBOURNE VIC 3003,-37.8123958,144.9538329,TP-2014-662,Sale and consumption of liquor assoicated with a restaurant and a reduction in the statutory car parking requirement,http://www.melbourne.vic.gov.au/BuildingandPlanning/Planning/Pages/Planningregisteronlinesearchresults.aspx?appid=217764,Yes
507 MacAulay Road KENSINGTON VIC 3031,-37.79454,144.929243,TP-2013-463/A,Demolition of the existing building (excluding the upper level of the front façade) and buildings and works including construction of a new building comprising of a restaurant on ground level  and dwellings above and a reduction in the car parking requirements,http://www.melbourne.vic.gov.au/BuildingandPlanning/Planning/Pages/Planningregisteronlinesearchresults.aspx?appid=217768,No
46 Shiel Street NORTH MELBOURNE VIC 3051,-37.796463,144.942948,TP-2014-425/A,Replacement of proposed brick fence to colourbond fence,http://www.melbourne.vic.gov.au/BuildingandPlanning/Planning/Pages/Planningregisteronlinesearchresults.aspx?appid=217676,Yes
Target Centre 222-244 Bourke Street MELBOURNE VIC 3000,-37.8133191,144.9662953,TP-2014-660,Buildings and works for alterations to the facade on level 4 and an exemption of the bicycle parking requirements,http://www.melbourne.vic.gov.au/BuildingandPlanning/Planning/Pages/Planningregisteronlinesearchresults.aspx?appid=217680,No
354-360 William Street MELBOURNE VIC 3000,-37.8106307,144.956026,TPM-2014-28,Proposed demolition of the existing building and development of a multi-storey (22 story) building for the purpose of dwellings with associated parking and ground level food and drinks premises,http://www.melbourne.vic.gov.au/BuildingandPlanning/Planning/Pages/Planningregisteronlinesearchresults.aspx?appid=217682,No
91-95 Dudley Street WEST MELBOURNE VIC 3003,-37.810543,144.949629,TP-2014-661,"Construction of multi story building; use of land at and below ground floor level as a shop (other than adult sex bookshop) and a restaurant; demolition of access to a road in a Road Zone, Category 1; and reduce the number of car parking spaces required",http://www.melbourne.vic.gov.au/BuildingandPlanning/Planning/Pages/Planningregisteronlinesearchresults.aspx?appid=217684,Yes
CBW Melbourne 147-185 William Street MELBOURNE VIC 3000,-37.814949,144.957487,TP-2014-653,Buildings and works for the construction and display of business identification signage and minor alterations to the facade,http://www.melbourne.vic.gov.au/BuildingandPlanning/Planning/Pages/Planningregisteronlinesearchresults.aspx?appid=217610,Yes
207-227 City Road SOUTHBANK VIC 3006,-37.8261771,144.9599105,TP-2014-654,"Partial demolition; alterations and addition to existing building including the construction of an awning; construction and display of real estate signs including a floodlit promotion panel, a floodlit major promotion panel and promotion sky bunting signs",http://www.melbourne.vic.gov.au/BuildingandPlanning/Planning/Pages/Planningregisteronlinesearchresults.aspx?appid=217613,Yes
455-467 Cardigan Street CARLTON VIC 3053,-37.7945206,144.9664013,TP-2014-655,4 lot subdivision of PS640946Q stage 10,http://www.melbourne.vic.gov.au/BuildingandPlanning/Planning/Pages/Planningregisteronlinesearchresults.aspx?appid=217614,Yes
48 Wirraway Drive FISHERMANS BEND VIC 3207,-37.82624,144.9090941,TP-2014-656,Construction and display of an internally illuminated business identification sign,http://www.melbourne.vic.gov.au/BuildingandPlanning/Planning/Pages/Planningregisteronlinesearchresults.aspx?appid=217618,Yes
115 Lonsdale Street MELBOURNE VIC 3000,-37.810602,144.968928,TP-2014-9,"part demolition, alterations and additions to a builing and erection of advertising signage.",http://www.melbourne.vic.gov.au/BuildingandPlanning/Planning/Pages/Planningregisteronlinesearchresults.aspx?appid=206630,Yes
123-129 Lonsdale Street MELBOURNE VIC 3000,-37.810711,144.968669,TP-2014-3,Construct and carry out works to install louvres/grids to windows on Level 4 of the exisitng building,http://www.melbourne.vic.gov.au/BuildingandPlanning/Planning/Pages/Planningregisteronlinesearchresults.aspx?appid=206540,Yes
"Unit 300, Level 3 150 Clarendon Street EAST MELBOURNE VIC 3002",-37.8121314,144.9834739,TP-2014-2,2 lot subdivision of PS602497J,http://www.melbourne.vic.gov.au/BuildingandPlanning/Planning/Pages/Planningregisteronlinesearchresults.aspx?appid=206543,Yes
517-537 Flinders Lane MELBOURNE VIC 3000,-37.819884,144.956608,TP-2014-4,Erection of business identification signage and construction of entry doors to shopfront,http://www.melbourne.vic.gov.au/BuildingandPlanning/Planning/Pages/Planningregisteronlinesearchresults.aspx?appid=206558,No
86 Collins Street MELBOURNE VIC 3000,-37.813921,144.970632,TP-2014-5,"Extending the use of the land of the existing hotel at 86A Collins Street, Melbourne to include the existing tenancy at 86 Collins Street, Melbourne; and building and works including partial demolition and alterations to the shop front",http://www.melbourne.vic.gov.au/BuildingandPlanning/Planning/Pages/Planningregisteronlinesearchresults.aspx?appid=206562,No
272-282 Lonsdale Street MELBOURNE VIC 3000,-37.81153,144.963997,TP-2014-1,Construct and display business identification signage,http://www.melbourne.vic.gov.au/BuildingandPlanning/Planning/Pages/Planningregisteronlinesearchresults.aspx?appid=206510,Yes
166-168 Lygon Street CARLTON VIC 3053,-37.803305,144.966813,TP-2013-1069,"Part demolition, alterations to the shopfront including external painting and erection of new business identification signs",http://www.melbourne.vic.gov.au/BuildingandPlanning/Planning/Pages/Planningregisteronlinesearchresults.aspx?appid=206393,Yes
223 Abbotsford Street NORTH MELBOURNE VIC 3051,-37.802004,144.945319,TP-2013-1070,Buildings and works for the part demolition of the existing building and construction of a dwelling,http://www.melbourne.vic.gov.au/BuildingandPlanning/Planning/Pages/Planningregisteronlinesearchresults.aspx?appid=206396,Yes
663-681 Punt Road SOUTH YARRA VIC 3141,-37.838798,144.985846,TP-2013-1068,Partial demolition of the existing building and building and works comprising a single storey extension,http://www.melbourne.vic.gov.au/BuildingandPlanning/Planning/Pages/Planningregisteronlinesearchresults.aspx?appid=206381,Yes
3 Baulderstone Walk KENSINGTON VIC 3031,-37.795233,144.92118,TP-2013-1067,Installation of a new satellite dish,http://www.melbourne.vic.gov.au/BuildingandPlanning/Planning/Pages/Planningregisteronlinesearchresults.aspx?appid=206383,Yes
Nova Apartments 219-233 Elizabeth Street MELBOURNE VIC 3000,-37.8130061,144.9625031,TP-2015-434,3 Lot Subdivision of PS429256W,http://www.melbourne.vic.gov.au/BuildingandPlanning/Planning/Pages/Planningregisteronlinesearchresults.aspx?appid=233982,No
22 Eades Place WEST MELBOURNE VIC 3003,-37.806062,144.95137,TP-2015-436,Renovation of a double storey residence in a heritage overlay.,http://www.melbourne.vic.gov.au/BuildingandPlanning/Planning/Pages/Planningregisteronlinesearchresults.aspx?appid=234025,No
466-468 Little Lonsdale Street MELBOURNE VIC 3000,-37.8123737,144.9581864,TP-2015-437,"Construction of buildings, comprising canopy and new entrance door, display of sigange, and use of part of the site as a tavern",http://www.melbourne.vic.gov.au/BuildingandPlanning/Planning/Pages/Planningregisteronlinesearchresults.aspx?appid=234027,No
30-34 Collins Street MELBOURNE VIC 3000,-37.8136644,144.9725104,TP-2015-435,Installation of new kitchen exhaust duct and pipes,http://www.melbourne.vic.gov.au/BuildingandPlanning/Planning/Pages/Planningregisteronlinesearchresults.aspx?appid=234031,No
Melbourne Grammar School 321-369 St Kilda Road MELBOURNE VIC 3004,-37.8338265,144.9763041,TP-2015-438,Alterations to existing building in accordance with enclosed plans.,http://www.melbourne.vic.gov.au/BuildingandPlanning/Planning/Pages/Planningregisteronlinesearchresults.aspx?appid=234034,No
138-144 Elgin Street CARLTON VIC 3053,-37.797144,144.969744,TP-2015-439,Construction and display of business identification signs,http://www.melbourne.vic.gov.au/BuildingandPlanning/Planning/Pages/Planningregisteronlinesearchresults.aspx?appid=234036,No
690-694 Elizabeth Street MELBOURNE VIC 3000,-37.802192,144.95824,TP-2015-423,220 Lot Subdivision of PS723381D,http://www.melbourne.vic.gov.au/BuildingandPlanning/Planning/Pages/Planningregisteronlinesearchresults.aspx?appid=233901,No
502-506 Victoria Street NORTH MELBOURNE VIC 3051,-37.8045204,144.9428712,TP-2015-160/A,Changes to operating times and amount of participants on site.,http://www.melbourne.vic.gov.au/BuildingandPlanning/Planning/Pages/Planningregisteronlinesearchresults.aspx?appid=233936,Yes
Lacrosse Docklands 673-683 La Trobe Street DOCKLANDS VIC 3008,-37.8148219,144.947334,TP-2015-424,Erect and display advertising signs in accordance with submitted plans.,http://www.melbourne.vic.gov.au/BuildingandPlanning/Planning/Pages/Planningregisteronlinesearchresults.aspx?appid=233941,Yes
19 Henry Street KENSINGTON VIC 3031,-37.794946,144.928179,TP-2015-427,Extension and alterations to existing dwelling and construction of a front fence,http://www.melbourne.vic.gov.au/BuildingandPlanning/Planning/Pages/Planningregisteronlinesearchresults.aspx?appid=233943,No
"Unit 4, 2 Phillip Court FISHERMANS BEND VIC 3207",-37.826151,144.92184,TP-2012-1028,Use of the building for a restricted recreation facility (24 hour gymnasium),http://www.melbourne.vic.gov.au/BuildingandPlanning/Planning/Pages/Planningregisteronlinesearchresults.aspx?appid=190237,Yes
206-218 Bourke Street MELBOURNE VIC 3000,-37.812847,144.966996,TP-2012-1029,Subdivision in stages in accordance with PS714390D Stage 1,http://www.melbourne.vic.gov.au/BuildingandPlanning/Planning/Pages/Planningregisteronlinesearchresults.aspx?appid=190240,No
288-294 Macaulay Road NORTH MELBOURNE VIC 3051,-37.794851,144.936673,TP-2012-1030,Construction and display of business identification signs,http://www.melbourne.vic.gov.au/BuildingandPlanning/Planning/Pages/Planningregisteronlinesearchresults.aspx?appid=190243,Yes
102 Barkly Street CARLTON VIC 3053,-37.799537,144.971618,TP-2012-1031,Alterations and additions to the existing dwelling including partial demolition,http://www.melbourne.vic.gov.au/BuildingandPlanning/Planning/Pages/Planningregisteronlinesearchresults.aspx?appid=190245,No
152-166 Sturt Street SOUTHBANK VIC 3006,-37.825495,144.966045,TP-2012-1032,Subdivision in accordance with PS636841E SECTION 32.,http://www.melbourne.vic.gov.au/BuildingandPlanning/Planning/Pages/Planningregisteronlinesearchresults.aspx?appid=190246,Yes
69-73 Collins Street MELBOURNE VIC 3000,-37.814207,144.9711828,TP-2012-1033,"Partial demolition of the existing shopfront, alterations and additions to shopfront and entranceway and erection of business identification signage",http://www.melbourne.vic.gov.au/BuildingandPlanning/Planning/Pages/Planningregisteronlinesearchresults.aspx?appid=190249,Yes
95-97 Millswyn Street SOUTH YARRA VIC 3141,-37.8350857,144.980468,TP-2012-1034,Subdivision in accordance with PS713489N.,http://www.melbourne.vic.gov.au/BuildingandPlanning/Planning/Pages/Planningregisteronlinesearchresults.aspx?appid=190250,Yes
48 Arden Street NORTH MELBOURNE VIC 3051,-37.800856,144.950643,TP-2012-1035,External painting of the existing dwellings facade,http://www.melbourne.vic.gov.au/BuildingandPlanning/Planning/Pages/Planningregisteronlinesearchresults.aspx?appid=190252,Yes
233-237 Lonsdale Street MELBOURNE VIC 3000,-37.8115263,144.9655442,TP-2012-1036,"Change of use of shop 2, 233 Lonsdale Street to a tavern, waiver of bicycle requirements and the construction of associated buildings and works",http://www.melbourne.vic.gov.au/BuildingandPlanning/Planning/Pages/Planningregisteronlinesearchresults.aspx?appid=190253,Yes
150-154 Collins Street MELBOURNE VIC 3000,-37.8152526,144.9635397,TP-2012-1015,Installation and display of temporary project signage,http://www.melbourne.vic.gov.au/BuildingandPlanning/Planning/Pages/Planningregisteronlinesearchresults.aspx?appid=190169,Yes
YHA Melbourne Central 562-564 Flinders Street MELBOURNE VIC 3000,-37.820655,144.955624,TP-2006-152/A,Amend permit and plans so as to allow changes to internal layout and provision of bicyle spaces on the roof,http://www.melbourne.vic.gov.au/BuildingandPlanning/Planning/Pages/Planningregisteronlinesearchresults.aspx?appid=209677,Yes
2 Riverside Quay SOUTHBANK VIC 3006,-37.821321,144.963326,TPM-2014-12,Mixed use multi storey commercial (office) development with lobbies and retail at ground floor and to reinvigorate the Riverside Quay Precinct (DTPLI ref. 2014000932),http://www.melbourne.vic.gov.au/BuildingandPlanning/Planning/Pages/Planningregisteronlinesearchresults.aspx?appid=209686,No
156-172 Victoria Street CARLTON VIC 3053,-37.8102218,144.997268,TPM-2014-13,"Building and works for the purposes of a multi-level, mixed use development, comprising residential dwellings, retail and food in the south corner of the Carlton Brewery Site (DTPLI ref 2014000834)",http://www.melbourne.vic.gov.au/BuildingandPlanning/Planning/Pages/Planningregisteronlinesearchresults.aspx?appid=209701,Yes
195 Drummond Street CARLTON VIC 3053,-37.801684,144.967826,TP-2014-168,Alterations and additions to facades and reconstruction of missing Victorian ornamentation,http://www.melbourne.vic.gov.au/BuildingandPlanning/Planning/Pages/Planningregisteronlinesearchresults.aspx?appid=209590,Yes
Dock 5 41-55 Victoria Harbour Promenade DOCKLANDS VIC 3008,-37.8193597,144.9429216,TPS-2014-10,Installation of a gas heater vent and flue cap,http://www.melbourne.vic.gov.au/BuildingandPlanning/Planning/Pages/Planningregisteronlinesearchresults.aspx?appid=209591,No
96 Powlett Street EAST MELBOURNE VIC 3002,-37.813614,144.986043,TP-2014-169,"Carry out development, including extending the existing dwelling",http://www.melbourne.vic.gov.au/BuildingandPlanning/Planning/Pages/Planningregisteronlinesearchresults.aspx?appid=209598,Yes
39 O'Shanassy Street NORTH MELBOURNE VIC 3051,-37.800398,144.94928,TP-2014-170,Partial demolition and buildings and works including an extension to the rear,http://www.melbourne.vic.gov.au/BuildingandPlanning/Planning/Pages/Planningregisteronlinesearchresults.aspx?appid=209600,Yes
277-283 Queensberry Street MELBOURNE VIC 3000,-37.804328,144.959339,TP-2014-171,To construct a dwelling,http://www.melbourne.vic.gov.au/BuildingandPlanning/Planning/Pages/Planningregisteronlinesearchresults.aspx?appid=209608,No
