Address,Permit No,Lat,Long,Description,Link,Issued
107-111 Lonsdale Street MELBOURNE VIC 3000,-37.810536,144.969121,TP-2014-421,Buildings and works to erect and display a business identification sign,http://www.melbourne.vic.gov.au/BuildingandPlanning/Planning/Pages/Planningregisteronlinesearchresults.aspx?appid=214246,Yes
77-87 Southbank Boulevard SOUTHBANK VIC 3006,-37.822995,144.96702,TPS-2014-21,Installation of plant equipment on the roof of the office building,http://www.melbourne.vic.gov.au/BuildingandPlanning/Planning/Pages/Planningregisteronlinesearchresults.aspx?appid=214103,No
22-32 Little La Trobe Street MELBOURNE VIC 3000,-37.809172,144.962672,TP-2007-275/B,Development of a multi-storey residential hotel (serviced apartments) and retail tenancies,http://www.melbourne.vic.gov.au/BuildingandPlanning/Planning/Pages/Planningregisteronlinesearchresults.aspx?appid=214104,Yes
468-478 Collins Street MELBOURNE VIC 3000,-37.8178567,144.9580902,TP-2014-516,Erect business identification signs,http://www.melbourne.vic.gov.au/BuildingandPlanning/Planning/Pages/Planningregisteronlinesearchresults.aspx?appid=215791,Yes
Grand Hyatt 121-131 Collins Street MELBOURNE VIC 3000,-37.8148608,144.9696421,TP-2014-517,Installation of an internally illuminated signage blade to the exterior of a retail tenancy within the Grand Hyatt Hotel premises,http://www.melbourne.vic.gov.au/BuildingandPlanning/Planning/Pages/Planningregisteronlinesearchresults.aspx?appid=215792,Yes
41-61 Boundary Road NORTH MELBOURNE VIC 3051,-37.793831,144.938893,TP-2013-399/A,Construction of mezzanine level to existing building and use of the premises as an educational training facility,http://www.melbourne.vic.gov.au/BuildingandPlanning/Planning/Pages/Planningregisteronlinesearchresults.aspx?appid=215794,Yes
28-32 Elizabeth Street MELBOURNE VIC 3000,-37.817299,144.964882,TP-2014-523,Erection and display of business identification signage and construct and carry out works,http://www.melbourne.vic.gov.au/BuildingandPlanning/Planning/Pages/Planningregisteronlinesearchresults.aspx?appid=215804,Yes
1-5 Queen Street MELBOURNE VIC 3000,-37.8188036,144.961811,TP-2014-524,Patrial demolition of the existing building and buildings and works to construct a mutli level mixed use development including overshadowing of the north bank of the Yarra River between 11am and 2pm on 22 June,http://www.melbourne.vic.gov.au/BuildingandPlanning/Planning/Pages/Planningregisteronlinesearchresults.aspx?appid=215807,No
Melbourne Childrens Court 451-477 Little Lonsdale Street MELBOURNE VIC 3000,-37.812725,144.958087,TP-2014-513,Alterations to existing building facade (enclosure of an existing balcony),http://www.melbourne.vic.gov.au/BuildingandPlanning/Planning/Pages/Planningregisteronlinesearchresults.aspx?appid=215705,Yes
MELBOURNE,28.0836269,-80.6081089,TP-2014-525,To display two promotional signs on the existing tram shelter,http://www.melbourne.vic.gov.au/BuildingandPlanning/Planning/Pages/Planningregisteronlinesearchresults.aspx?appid=215714,No
DOCKLANDS,-37.8150178,144.9460078,TP-2014-537,Display of one promotional sign on existing tram shelter,http://www.melbourne.vic.gov.au/BuildingandPlanning/Planning/Pages/Planningregisteronlinesearchresults.aspx?appid=215856,No
MELBOURNE,28.0836269,-80.6081089,TP-2014-539,Display  promotional signage on existing tram shelters.,http://www.melbourne.vic.gov.au/BuildingandPlanning/Planning/Pages/Planningregisteronlinesearchresults.aspx?appid=215866,No
45-47 Little Leveson Street NORTH MELBOURNE VIC 3051,-37.8042937,144.9516652,TP-2014-512,2 lot subdivision of PS546856R,http://www.melbourne.vic.gov.au/BuildingandPlanning/Planning/Pages/Planningregisteronlinesearchresults.aspx?appid=215616,Yes
351-357 Collins Street MELBOURNE VIC 3000,-37.8173248,144.9628834,TP-2012-467/A,Conctruction and display of internally illuminated  business identification signage,http://www.melbourne.vic.gov.au/BuildingandPlanning/Planning/Pages/Planningregisteronlinesearchresults.aspx?appid=192243,Yes
Part Ground 272 Lygon Street CARLTON VIC 3053,-37.800416,144.9670637,TP-2012-730/A,Display of business identification signage (decals) and external paintwork.,http://www.melbourne.vic.gov.au/BuildingandPlanning/Planning/Pages/Planningregisteronlinesearchresults.aspx?appid=192258,Yes
733-747 Collins Street DOCKLANDS VIC 3008,-37.8207766,144.9492986,TP-2013-86,Construction and display of three internally illuminated high wall business identification signs,http://www.melbourne.vic.gov.au/BuildingandPlanning/Planning/Pages/Planningregisteronlinesearchresults.aspx?appid=192269,No
71-89 Hobsons Road KENSINGTON VIC 3031,-37.796161,144.916489,TP-2013-87,"Use and development of the land for the purposes of a part 3, part 6 storey mixed use development with 182 dwellings, one retail and two commercial tenancies, and waiver of parking, bicycle parking and loading requirements",http://www.melbourne.vic.gov.au/BuildingandPlanning/Planning/Pages/Planningregisteronlinesearchresults.aspx?appid=192275,No
96-98 Flinders Street MELBOURNE VIC 3000,-37.815896,144.971476,TP-2013-88,"Erection of wall mounted, internally-illuminated  business identification signage",http://www.melbourne.vic.gov.au/BuildingandPlanning/Planning/Pages/Planningregisteronlinesearchresults.aspx?appid=192289,Yes
"Part Suite 18, 20 Commercial Road MELBOURNE VIC 3004",-37.693642,145.041654,TP-2013-89,"2 lot subdivision in accordance with RP018794 Section 32 - Subdivision of lots 18, 31 & 32 on RP018794 creating lots 18A & 18B",http://www.melbourne.vic.gov.au/BuildingandPlanning/Planning/Pages/Planningregisteronlinesearchresults.aspx?appid=192292,Yes
196 Lorimer Street FISHERMANS BEND VIC 3207,-37.830586,144.901201,TP-2013-83,Erect a shed to house a vehicle mounted mobile bridge inspection platform unit,http://www.melbourne.vic.gov.au/BuildingandPlanning/Planning/Pages/Planningregisteronlinesearchresults.aspx?appid=192185,Yes
589-605 Collins Street MELBOURNE VIC 3000,-37.819367,144.955217,TP-2013-84,Erect and display two internally illuminated high wall business identification signs,http://www.melbourne.vic.gov.au/BuildingandPlanning/Planning/Pages/Planningregisteronlinesearchresults.aspx?appid=192188,Yes
122-124 Errol Street NORTH MELBOURNE VIC 3051,-37.802049,144.950128,TP-2013-85,"Use of the land as an Office (temporary display suite), associated buildings and works, advertising signage and car parking dispensation in a Mixed Use Zone, Heirtage Overlay and Design and Development Overlay.",http://www.melbourne.vic.gov.au/BuildingandPlanning/Planning/Pages/Planningregisteronlinesearchresults.aspx?appid=192189,Yes
13A Victoria Street MELBOURNE VIC 3000,-37.807624,144.967954,TP-2004-932/A,Amend Condition 7 of the planning permit to alter the operating hours,http://www.melbourne.vic.gov.au/BuildingandPlanning/Planning/Pages/Planningregisteronlinesearchresults.aspx?appid=192076,No
80 Munster Terrace NORTH MELBOURNE VIC 3051,-37.801444,144.943175,TP-2014-978,Demolition of the existing fence and construction of a new fence,http://www.melbourne.vic.gov.au/BuildingandPlanning/Planning/Pages/Planningregisteronlinesearchresults.aspx?appid=223222,Yes
90-98 Curzon Street NORTH MELBOURNE VIC 3051,-37.801804,144.948607,TP-2014-979,Subdivision of PS647769X,http://www.melbourne.vic.gov.au/BuildingandPlanning/Planning/Pages/Planningregisteronlinesearchresults.aspx?appid=223225,Yes
356-362 King Street WEST MELBOURNE VIC 3003,-37.808324,144.952351,TP-2014-348/A,Use of the building for the purpose of a residential hotel,http://www.melbourne.vic.gov.au/BuildingandPlanning/Planning/Pages/Planningregisteronlinesearchresults.aspx?appid=223240,Yes
The Merchant 834-846 Bourke Street DOCKLANDS VIC 3008,-37.8198976,144.943217,TP-2014-980,Erection and display of business identification signage,http://www.melbourne.vic.gov.au/BuildingandPlanning/Planning/Pages/Planningregisteronlinesearchresults.aspx?appid=223278,Yes
Capitol Arcade 109-117 Swanston Street MELBOURNE VIC 3000,-37.81495,144.965958,TP-2014-973,Proposed installation of split system airconditioner,http://www.melbourne.vic.gov.au/BuildingandPlanning/Planning/Pages/Planningregisteronlinesearchresults.aspx?appid=223162,No
271-285 Collins Street MELBOURNE VIC 3000,-37.816334,144.964693,TP-2014-974,Waiver of the bicycle facilities requirements for an education centre under Clause 52.34 of the Melbourne Planning Scheme,http://www.melbourne.vic.gov.au/BuildingandPlanning/Planning/Pages/Planningregisteronlinesearchresults.aspx?appid=223167,Yes
Arts Centre Melbourne 2-128 St Kilda Road SOUTHBANK VIC 3006,-37.8220166,144.9693148,TP-2014-975,Construction of buildings and works to the existing building,http://www.melbourne.vic.gov.au/BuildingandPlanning/Planning/Pages/Planningregisteronlinesearchresults.aspx?appid=223171,Yes
2-12 Batmans Hill Drive DOCKLANDS VIC 3008,-37.821671,144.950321,TP-2014-977,"Preliminary site works including the removal of existing works, excavation, basement slab, piling and ground slab",http://www.melbourne.vic.gov.au/BuildingandPlanning/Planning/Pages/Planningregisteronlinesearchresults.aspx?appid=223203,Yes
38-46 Sabre Drive FISHERMANS BEND VIC 3207,-37.8284772,144.9076195,TP-2014-972,Construction of a mezzanine level within the existing building,http://www.melbourne.vic.gov.au/BuildingandPlanning/Planning/Pages/Planningregisteronlinesearchresults.aspx?appid=223057,Yes
QV Village 278-300 Swanston Street MELBOURNE VIC 3000,-37.810506,144.96586,TP-2014-963,Amendment to existing signage and relocation of auto door,http://www.melbourne.vic.gov.au/BuildingandPlanning/Planning/Pages/Planningregisteronlinesearchresults.aspx?appid=222970,Yes
253-265 Flinders Lane MELBOURNE VIC 3000,-37.8169266,144.9656826,TP-2015-494,Alterations and paintwork to shopfront and construction and display of business identification signage,http://www.melbourne.vic.gov.au/BuildingandPlanning/Planning/Pages/Planningregisteronlinesearchresults.aspx?appid=235120,Yes
480-488 Elizabeth Street MELBOURNE VIC 3000,-37.807515,144.960476,TPM-2015-14,"Construction of a 68 storey mixed use development comprising hotel, residential apartments and food and drink premises (excluding tavern).",http://www.melbourne.vic.gov.au/BuildingandPlanning/Planning/Pages/Planningregisteronlinesearchresults.aspx?appid=234747,No
1-23 City Road SOUTHBANK VIC 3006,-37.821381,144.967578,TP-2015-483,"Testing Grounds temporary infrastructure upgrade, program and use to remain the same as current.",http://www.melbourne.vic.gov.au/BuildingandPlanning/Planning/Pages/Planningregisteronlinesearchresults.aspx?appid=235069,No
131-137 Barry Street CARLTON VIC 3053,-37.800827,144.959373,TP-2015-484,Construction of an access ramp,http://www.melbourne.vic.gov.au/BuildingandPlanning/Planning/Pages/Planningregisteronlinesearchresults.aspx?appid=235077,Yes
57 Miller Street WEST MELBOURNE VIC 3003,-37.805989,144.945788,TP-2015-485,Alterations to dwelling.,http://www.melbourne.vic.gov.au/BuildingandPlanning/Planning/Pages/Planningregisteronlinesearchresults.aspx?appid=235080,No
271-285 Collins Street MELBOURNE VIC 3000,-37.816334,144.964693,TP-2015-486,Installation of shadesails on Level 1-4 of the Elizabeth Street frontage.,http://www.melbourne.vic.gov.au/BuildingandPlanning/Planning/Pages/Planningregisteronlinesearchresults.aspx?appid=235081,No
150-162 Flinders Street MELBOURNE VIC 3000,-37.816571,144.969425,TP-2015-487,Multi use and multi level development. Demolition and associated works including renovation of the Forum Theatre in accordance with the plans and associated documents filed.,http://www.melbourne.vic.gov.au/BuildingandPlanning/Planning/Pages/Planningregisteronlinesearchresults.aspx?appid=235083,No
25 Bangalore Street KENSINGTON VIC 3031,-37.793866,144.925305,TP-2015-489,Partial demolition and alterations and additions to the existing single dwelling,http://www.melbourne.vic.gov.au/BuildingandPlanning/Planning/Pages/Planningregisteronlinesearchresults.aspx?appid=235085,No
12-18 Meyers Place MELBOURNE VIC 3000,-37.812216,144.972451,TP-2015-490,Use of the land as a Tavern and a reduction in the statutory bike parking requirement,http://www.melbourne.vic.gov.au/BuildingandPlanning/Planning/Pages/Planningregisteronlinesearchresults.aspx?appid=235093,No
50-52 Little Bourke Street MELBOURNE VIC 3000,-37.8108256,144.97098,TP-2015-488,Retrospective approval of installation of building services including a duct to the rear facade and air conditioning units to the roof,http://www.melbourne.vic.gov.au/BuildingandPlanning/Planning/Pages/Planningregisteronlinesearchresults.aspx?appid=235347,No
Melbourne Convention Centre 7-23 Spencer Street DOCKLANDS VIC 3008,-37.822202,144.95443,TP-2013-407,External buildings and works and demolition of former Melbourne Convention Centre,http://www.melbourne.vic.gov.au/BuildingandPlanning/Planning/Pages/Planningregisteronlinesearchresults.aspx?appid=197058,Yes
291-309 Smithfield Road KENSINGTON VIC 3031,-37.792147,144.918736,TP-2013-408,Replacement of existing advertising signage,http://www.melbourne.vic.gov.au/BuildingandPlanning/Planning/Pages/Planningregisteronlinesearchresults.aspx?appid=197060,Yes
60 Ormond Street KENSINGTON VIC 3031,-37.797196,144.929069,TP-2013-409,Buildings and works to construct a new garage including part demolition,http://www.melbourne.vic.gov.au/BuildingandPlanning/Planning/Pages/Planningregisteronlinesearchresults.aspx?appid=197062,No
1-23 City Road SOUTHBANK VIC 3006,-37.821381,144.967578,TP-2013-410,"Change of use of part of the land to an arts and craft centre, the construction of buildings and works and internally illuminated signage",http://www.melbourne.vic.gov.au/BuildingandPlanning/Planning/Pages/Planningregisteronlinesearchresults.aspx?appid=197063,Yes
366-384 Queensberry Street NORTH MELBOURNE VIC 3051,-37.803241,144.954954,TP-2013-406,Installation of advertising signage (hoarding) for the sale of real estate,http://www.melbourne.vic.gov.au/BuildingandPlanning/Planning/Pages/Planningregisteronlinesearchresults.aspx?appid=197034,Yes
41-61 Boundary Road NORTH MELBOURNE VIC 3051,-37.793831,144.938893,TP-2013-399,Use of the premises as an educational training facility,http://www.melbourne.vic.gov.au/BuildingandPlanning/Planning/Pages/Planningregisteronlinesearchresults.aspx?appid=196960,Yes
82 McConnell Street KENSINGTON VIC 3031,-37.79262,144.928548,TP-2011-179/A,Relocation of the basement and increase the first floor area by 500mm in depth to the rear of the dwelling.,http://www.melbourne.vic.gov.au/BuildingandPlanning/Planning/Pages/Planningregisteronlinesearchresults.aspx?appid=196963,No
131-141 Russell Street MELBOURNE VIC 3000,-37.813425,144.967853,TP-2013-400,Use part of level 11 of the approved building as a tavern,http://www.melbourne.vic.gov.au/BuildingandPlanning/Planning/Pages/Planningregisteronlinesearchresults.aspx?appid=196970,Yes
79-89 Leveson Street NORTH MELBOURNE VIC 3051,-37.8024021,144.9508937,TP-2013-401,Subdivision in accordance with PS644181B.,http://www.melbourne.vic.gov.au/BuildingandPlanning/Planning/Pages/Planningregisteronlinesearchresults.aspx?appid=196973,Yes
Victoria Harbour Precinct 839-899 Collins Street DOCKLANDS VIC 3008,-37.8208296,144.9479048,TP-2013-402,To demolish a building,http://www.melbourne.vic.gov.au/BuildingandPlanning/Planning/Pages/Planningregisteronlinesearchresults.aspx?appid=196974,Yes
12 Lothian Street NORTH MELBOURNE VIC 3051,-37.803705,144.944609,TP-2015-330,Change of use to leisure and recreation facility (calisthenics gym studio),http://www.melbourne.vic.gov.au/BuildingandPlanning/Planning/Pages/Planningregisteronlinesearchresults.aspx?appid=232282,No
Global Television Studios 49-61 Coventry Street SOUTHBANK VIC 3006,-37.829599,144.968355,TP-2014-120/A,Construction of a storage building in the eastern laneway (western side of Studio A),http://www.melbourne.vic.gov.au/BuildingandPlanning/Planning/Pages/Planningregisteronlinesearchresults.aspx?appid=232194,No
6 Boughton Place WEST MELBOURNE VIC 3003,-37.811487,144.951911,TP-2001-299/A,Privacy screens installed on rooftop garden.,http://www.melbourne.vic.gov.au/BuildingandPlanning/Planning/Pages/Planningregisteronlinesearchresults.aspx?appid=232236,No
Stargate Apartments 114-122 Franklin Street MELBOURNE VIC 3000,-37.8084873,144.958924,TP-2015-313,Construction and carrying out of works to enclose outdoor spaces  of Lot 1019 at roof level to create two new office tenancies.,http://www.melbourne.vic.gov.au/BuildingandPlanning/Planning/Pages/Planningregisteronlinesearchresults.aspx?appid=232049,No
104-110 Exhibition Street MELBOURNE VIC 3000,-37.813162,144.971123,TP-2015-314,Construction and display of electronic promotion signs,http://www.melbourne.vic.gov.au/BuildingandPlanning/Planning/Pages/Planningregisteronlinesearchresults.aspx?appid=232052,Yes
Carlow House 281-291 Flinders Lane MELBOURNE VIC 3000,-37.8182059,144.9651594,TP-2015-315,Construction and display of an internally illuminated building identification sign,http://www.melbourne.vic.gov.au/BuildingandPlanning/Planning/Pages/Planningregisteronlinesearchresults.aspx?appid=232056,Yes
578-606 Bourke Street MELBOURNE VIC 3000,-37.815311,144.955946,TP-2015-316,Construction and display of business identification signs,http://www.melbourne.vic.gov.au/BuildingandPlanning/Planning/Pages/Planningregisteronlinesearchresults.aspx?appid=232060,Yes
294-296 Arden Street NORTH MELBOURNE VIC 3051,-37.799331,144.938488,TP-2015-317,"To use the land as an office, buildings and works for in increase in the first floor area, external alterations to the existing building and a reduction in the standard car parking requirement",http://www.melbourne.vic.gov.au/BuildingandPlanning/Planning/Pages/Planningregisteronlinesearchresults.aspx?appid=232062,No
159-169 Curzon Street NORTH MELBOURNE VIC 3051,-37.7990019,144.9487477,TP-2015-318,Subdivision to allocate existing car parking presently within common property of PS729176W,http://www.melbourne.vic.gov.au/BuildingandPlanning/Planning/Pages/Planningregisteronlinesearchresults.aspx?appid=232064,No
115-127 Russell Street MELBOURNE VIC 3000,-37.813667,144.9682,TP-2015-312,Alterations to the exterior of the building including replacement awning and a new architectural feature and erection of business identification signs,http://www.melbourne.vic.gov.au/BuildingandPlanning/Planning/Pages/Planningregisteronlinesearchresults.aspx?appid=231942,Yes
146 Swanston Street MELBOURNE VIC 3000,-37.814161,144.966231,TP-2015-474,Proposed alterations to existing shopfront signage.,http://www.melbourne.vic.gov.au/BuildingandPlanning/Planning/Pages/Planningregisteronlinesearchresults.aspx?appid=234691,Yes
3A-3B Haines Street NORTH MELBOURNE VIC 3051,-37.7990017,144.9501638,TP-2015-470,"Demolition of existing building and construction of a three-storey dwelling with decking, front fence and a reduction of the car parking requirements",http://www.melbourne.vic.gov.au/BuildingandPlanning/Planning/Pages/Planningregisteronlinesearchresults.aspx?appid=234601,No
33-37 Walsh Street WEST MELBOURNE VIC 3003,-37.8084599,144.9533895,TP-2014-1043/A,Removal of Condition 6 of original permit.,http://www.melbourne.vic.gov.au/BuildingandPlanning/Planning/Pages/Planningregisteronlinesearchresults.aspx?appid=234658,Yes
Rydges on Swanston - Melbourne 701-713 Swanston Street CARLTON VIC 3053,-37.801416,144.96336,TP-2013-337/A,Amend the Permit to allow amplified music to be played on the rooftop deck area by removing Condition 4 and amending Condition 11 to read 'No amplified live music is permitted on the premises without the prior written consent of the Responsible Authority',http://www.melbourne.vic.gov.au/BuildingandPlanning/Planning/Pages/Planningregisteronlinesearchresults.aspx?appid=234684,No
WRAP Residences 133-139 City Road SOUTHBANK VIC 3006,-37.823544,144.963512,TP-2015-471,Construction and display of internally illuminated business identification signs,http://www.melbourne.vic.gov.au/BuildingandPlanning/Planning/Pages/Planningregisteronlinesearchresults.aspx?appid=234687,No
562-574 Bourke Street MELBOURNE VIC 3000,-37.815509,144.95676,TP-2015-154/A,Amendments to approved building identification signage.,http://www.melbourne.vic.gov.au/BuildingandPlanning/Planning/Pages/Planningregisteronlinesearchresults.aspx?appid=234517,No
352-358 Collins Street MELBOURNE VIC 3000,-37.816329,144.962592,TP-2015-458,"Alterations to the facade of the building, construction and display of internally illuminated business identification signs and waiver of statutory bicycle parking requirement in association with the increase in floor area on Mezzanine Level",http://www.melbourne.vic.gov.au/BuildingandPlanning/Planning/Pages/Planningregisteronlinesearchresults.aspx?appid=234530,No
354-360 William Street MELBOURNE VIC 3000,-37.8106307,144.956026,TP-2015-459,Construction of a multi-storey development for the purpose of a residential hotel,http://www.melbourne.vic.gov.au/BuildingandPlanning/Planning/Pages/Planningregisteronlinesearchresults.aspx?appid=234536,No
117-131 Capel Street NORTH MELBOURNE VIC 3051,-37.805061,144.954828,TP-2015-460,"To use the land identified as Suite 1.01 as an Education Centre, a waiver of the standard car parking requirements and the display of business identification signage",http://www.melbourne.vic.gov.au/BuildingandPlanning/Planning/Pages/Planningregisteronlinesearchresults.aspx?appid=234537,No
The Carron Tavern 396-400 Spencer Street WEST MELBOURNE VIC 3003,-37.811109,144.950986,TP-2015-461,Use of the land for the purpose of a medical centre,http://www.melbourne.vic.gov.au/BuildingandPlanning/Planning/Pages/Planningregisteronlinesearchresults.aspx?appid=234540,No
543 MacAulay Road KENSINGTON VIC 3031,-37.794412,144.927998,TP-2014-829,Alterations and additions to the existing dwelling including the construction of a rooftop terrace,http://www.melbourne.vic.gov.au/BuildingandPlanning/Planning/Pages/Planningregisteronlinesearchresults.aspx?appid=220842,Yes
Part Ground 377 Little Bourke Street MELBOURNE VIC 3000,-37.8137422,144.9615712,TP-2014-828,Alterations to the facade and erection of signage,http://www.melbourne.vic.gov.au/BuildingandPlanning/Planning/Pages/Planningregisteronlinesearchresults.aspx?appid=220843,Yes
22-24 Bennetts Lane MELBOURNE VIC 3000,-37.808813,144.967836,TP-2014-830,"Demolition of the existing building, Construction of an eight storey building comprising one commercial unit and four dwellings and associated Works",http://www.melbourne.vic.gov.au/BuildingandPlanning/Planning/Pages/Planningregisteronlinesearchresults.aspx?appid=220852,No
539-555 Swanston Street CARLTON VIC 3053,-37.8054086,144.9630268,TP-2014-819,858 lot subdivision of PS643901X Stage 3 (Building 5 former CUB site),http://www.melbourne.vic.gov.au/BuildingandPlanning/Planning/Pages/Planningregisteronlinesearchresults.aspx?appid=218654,Yes
287-289 Little Collins Street MELBOURNE VIC 3000,-37.815372,144.96491,TP-2014-820,Installation of signage to external wall,http://www.melbourne.vic.gov.au/BuildingandPlanning/Planning/Pages/Planningregisteronlinesearchresults.aspx?appid=218666,Yes
285 Little Collins Street MELBOURNE VIC 3000,-37.815012,144.965111,TP-2014-821,Installation of a tenancy sign to the external wall,http://www.melbourne.vic.gov.au/BuildingandPlanning/Planning/Pages/Planningregisteronlinesearchresults.aspx?appid=218673,Yes
56 Rosslyn Street WEST MELBOURNE VIC 3003,-37.807517,144.952403,TP-2014-822,To use the land for the sale and consumption of liquor (Cafe and Restaurant Licence),http://www.melbourne.vic.gov.au/BuildingandPlanning/Planning/Pages/Planningregisteronlinesearchresults.aspx?appid=218683,Yes
54 Collett Street KENSINGTON VIC 3031,-37.791032,144.933061,TP-2014-818,Single-storey extension to existing dwelling,http://www.melbourne.vic.gov.au/BuildingandPlanning/Planning/Pages/Planningregisteronlinesearchresults.aspx?appid=216577,Yes
Ground 264 Swanston Street MELBOURNE VIC 3000,-37.811807,144.965146,TP-2014-813,Buildings and works for the installation of a new kitchen exhaust riser and fan to Stevenson Lane,http://www.melbourne.vic.gov.au/BuildingandPlanning/Planning/Pages/Planningregisteronlinesearchresults.aspx?appid=220750,Yes
341-357 Bourke Street MELBOURNE VIC 3000,-37.8144089,144.9636653,TP-2014-815,"Partial demolition, building and works and erection of business identification signs",http://www.melbourne.vic.gov.au/BuildingandPlanning/Planning/Pages/Planningregisteronlinesearchresults.aspx?appid=220776,Yes
198-204 Faraday Street CARLTON VIC 3053,-37.798508,144.967835,TP-2014-557,Display of a temporary promotion sign on hoarding to the front of the existing building,http://www.melbourne.vic.gov.au/BuildingandPlanning/Planning/Pages/Planningregisteronlinesearchresults.aspx?appid=216194,Yes
110-112 Queensberry Street CARLTON VIC 3053,-37.804562,144.965343,TP-2014-558,Construction and display of a temporary sign advertising the sale of property on the site,http://www.melbourne.vic.gov.au/BuildingandPlanning/Planning/Pages/Planningregisteronlinesearchresults.aspx?appid=216196,Yes
University of Melbourne 156-292 Grattan Street PARKVILLE VIC 3010,-37.7999598,144.9605636,TP-2014-559,Proposed remediation works to 4 sets of existing window,http://www.melbourne.vic.gov.au/BuildingandPlanning/Planning/Pages/Planningregisteronlinesearchresults.aspx?appid=216216,No
53 Mason Street SOUTH YARRA VIC 3141,-37.836186,144.980769,TP-2014-561,"Demolition of the existing roller door and buildings and works for the construction of an automatic driveway gate, rear storage gates and new paving",http://www.melbourne.vic.gov.au/BuildingandPlanning/Planning/Pages/Planningregisteronlinesearchresults.aspx?appid=216223,Yes
